{
  "schema_version": "1.0.0",
  "feed_id": "macro_scores",
  "last_updated": "2026-10-29T13:46:23+09:00",
  "source": {
    "label": "World Bank",
    "url": "https://data.worldbank.org/",
    "license": "CC BY 4.0",
    "disclaimer_ja": "本ページの数値は公開統計の二次加工です。投資・経営判断は自己責任でお願いします。"
  },
  "meta": {
    "countries": [
      {
        "iso2": "VN",
        "name_ja": "ベトナム",
        "name_en": "Vietnam",
        "region": "southeast_asia"
      },
      {
        "iso2": "TH",
        "name_ja": "タイ",
        "name_en": "Thailand",
        "region": "southeast_asia"
      },
      {
        "iso2": "CN",
        "name_ja": "中国",
        "name_en": "China",
        "region": "east_asia"
      },
      {
        "iso2": "IN",
        "name_ja": "インド",
        "name_en": "India",
        "region": "south_asia"
      },
      {
        "iso2": "ID",
        "name_ja": "インドネシア",
        "name_en": "Indonesia",
        "region": "southeast_asia"
      },
      {
        "iso2": "PH",
        "name_ja": "フィリピン",
        "name_en": "Philippines",
        "region": "southeast_asia"
      },
      {
        "iso2": "MY",
        "name_ja": "マレーシア",
        "name_en": "Malaysia",
        "region": "southeast_asia"
      },
      {
        "iso2": "SG",
        "name_ja": "シンガポール",
        "name_en": "Singapore",
        "region": "southeast_asia"
      },
      {
        "iso2": "KR",
        "name_ja": "韓国",
        "name_en": "Korea",
        "region": "east_asia"
      },
      {
        "iso2": "HK",
        "name_ja": "香港",
        "name_en": "Hong Kong SAR",
        "region": "east_asia"
      },
      {
        "iso2": "AE",
        "name_ja": "UAE",
        "name_en": "United Arab Emirates",
        "region": "middle_east"
      },
      {
        "iso2": "SA",
        "name_ja": "サウジアラビア",
        "name_en": "Saudi Arabia",
        "region": "middle_east"
      },
      {
        "iso2": "TR",
        "name_ja": "トルコ",
        "name_en": "Turkiye",
        "region": "middle_east"
      },
      {
        "iso2": "GB",
        "name_ja": "英国",
        "name_en": "United Kingdom",
        "region": "europe"
      },
      {
        "iso2": "DE",
        "name_ja": "ドイツ",
        "name_en": "Germany",
        "region": "europe"
      },
      {
        "iso2": "FR",
        "name_ja": "フランス",
        "name_en": "France",
        "region": "europe"
      },
      {
        "iso2": "US",
        "name_ja": "米国",
        "name_en": "United States",
        "region": "north_america"
      },
      {
        "iso2": "CA",
        "name_ja": "カナダ",
        "name_en": "Canada",
        "region": "north_america"
      },
      {
        "iso2": "BR",
        "name_ja": "ブラジル",
        "name_en": "Brazil",
        "region": "latin_america"
      },
      {
        "iso2": "JP",
        "name_ja": "日本",
        "name_en": "Japan",
        "region": "east_asia"
      },
      {
        "iso2": "TW",
        "name_ja": "台湾",
        "name_en": "Taiwan",
        "region": "east_asia"
      }
    ],
    "year_coverage": {
      "from": 2020,
      "to": 2024
    },
    "score_method_ja": "名目GDP・実質成長率・人口・都市化率・一人当たりGNI・対内FDIを各国間で正規化し、単純平均で 0–100 の合成スコアとする（Phase 1）。ウェイト調整は Phase 2 で検討。",
    "metric_ids": [
      "macro.gdp.current_usd",
      "macro.gdp.growth_pct",
      "macro.population.total",
      "macro.urban_population.pct",
      "macro.gni_per_capita.current_usd",
      "macro.fdi_inflow.current_usd",
      "macro.fx_rate.lcu_per_usd",
      "macro.inflation.cpi_pct"
    ]
  },
  "modules": {
    "A1_attractiveness": {
      "module_id": "A1",
      "title_ja": "国別 海外進出魅力度スコア",
      "title_en": "Country attractiveness score",
      "last_updated": "2026-10-29T13:46:23+09:00",
      "source": {
        "label": "World Bank（Atlas 合成）",
        "url": "https://data.worldbank.org/"
      },
      "as_of_year": 2024,
      "ranking": [
        {
          "rank": 1,
          "iso2": "US",
          "score": 72.6,
          "components": {
            "gdp_size": 100.0,
            "gdp_growth": 43.3,
            "population": 23.1,
            "urbanization": 69.2,
            "gni_per_capita": 100.0,
            "fdi_inflow": 100.0
          }
        },
        {
          "rank": 2,
          "iso2": "SG",
          "score": 52.8,
          "components": {
            "gdp_size": 0.6,
            "gdp_growth": 76.9,
            "population": 0.0,
            "urbanization": 100.0,
            "gni_per_capita": 91.2,
            "fdi_inflow": 47.8
          }
        },
        {
          "rank": 3,
          "iso2": "CN",
          "score": 51.9,
          "components": {
            "gdp_size": 63.4,
            "gdp_growth": 71.8,
            "population": 97.1,
            "urbanization": 47.2,
            "gni_per_capita": 13.8,
            "fdi_inflow": 17.9
          }
        },
        {
          "rank": 4,
          "iso2": "HK",
          "score": 42.4,
          "components": {
            "gdp_size": 0.0,
            "gdp_growth": 41.1,
            "population": 0.1,
            "urbanization": 100.0,
            "gni_per_capita": 68.3,
            "fdi_inflow": 44.8
          }
        },
        {
          "rank": 5,
          "iso2": "IN",
          "score": 37.4,
          "components": {
            "gdp_size": 11.6,
            "gdp_growth": 100.0,
            "population": 100.0,
            "urbanization": 0.0,
            "gni_per_capita": 0.0,
            "fdi_inflow": 12.9
          }
        },
        {
          "rank": 6,
          "iso2": "AE",
          "score": 36.3,
          "components": {
            "gdp_size": 0.5,
            "gdp_growth": 59.1,
            "population": 0.3,
            "urbanization": 78.1,
            "gni_per_capita": 61.0,
            "fdi_inflow": 18.9
          }
        },
        {
          "rank": 7,
          "iso2": "CA",
          "score": 34.0,
          "components": {
            "gdp_size": 6.4,
            "gdp_growth": 33.5,
            "population": 2.4,
            "urbanization": 73.2,
            "gni_per_capita": 64.2,
            "fdi_inflow": 24.5
          }
        },
        {
          "rank": 8,
          "iso2": "BR",
          "score": 31.8,
          "components": {
            "gdp_size": 6.2,
            "gdp_growth": 51.5,
            "population": 14.3,
            "urbanization": 81.3,
            "gni_per_capita": 9.2,
            "fdi_inflow": 28.1
          }
        },
        {
          "rank": 9,
          "iso2": "DE",
          "score": 30.4,
          "components": {
            "gdp_size": 14.8,
            "gdp_growth": 0.0,
            "population": 5.4,
            "urbanization": 72.2,
            "gni_per_capita": 65.4,
            "fdi_inflow": 24.4
          }
        },
        {
          "rank": 10,
          "iso2": "FR",
          "score": 29.5,
          "components": {
            "gdp_size": 9.5,
            "gdp_growth": 22.2,
            "population": 4.3,
            "urbanization": 67.2,
            "gni_per_capita": 53.0,
            "fdi_inflow": 21.0
          }
        },
        {
          "rank": 11,
          "iso2": "SA",
          "score": 29.2,
          "components": {
            "gdp_size": 2.9,
            "gdp_growth": 41.4,
            "population": 2.0,
            "urbanization": 75.9,
            "gni_per_capita": 41.6,
            "fdi_inflow": 11.1
          }
        },
        {
          "rank": 12,
          "iso2": "GB",
          "score": 28.2,
          "components": {
            "gdp_size": 11.4,
            "gdp_growth": 20.8,
            "population": 4.4,
            "urbanization": 74.1,
            "gni_per_capita": 58.2,
            "fdi_inflow": 0.0
          }
        },
        {
          "rank": 13,
          "iso2": "JP",
          "score": 27.7,
          "components": {
            "gdp_size": 13.1,
            "gdp_growth": 3.4,
            "population": 8.2,
            "urbanization": 87.9,
            "gni_per_capita": 43.1,
            "fdi_inflow": 10.3
          }
        },
        {
          "rank": 14,
          "iso2": "TR",
          "score": 27.3,
          "components": {
            "gdp_size": 3.3,
            "gdp_growth": 50.3,
            "population": 5.5,
            "urbanization": 83.5,
            "gni_per_capita": 13.5,
            "fdi_inflow": 8.0
          }
        },
        {
          "rank": 15,
          "iso2": "KR",
          "score": 27.2,
          "components": {
            "gdp_size": 5.1,
            "gdp_growth": 32.9,
            "population": 3.2,
            "urbanization": 70.9,
            "gni_per_capita": 42.6,
            "fdi_inflow": 8.3
          }
        },
        {
          "rank": 16,
          "iso2": "MY",
          "score": 26.8,
          "components": {
            "gdp_size": 0.0,
            "gdp_growth": 73.7,
            "population": 2.0,
            "urbanization": 64.3,
            "gni_per_capita": 11.3,
            "fdi_inflow": 9.2
          }
        },
        {
          "rank": 17,
          "iso2": "ID",
          "score": 24.4,
          "components": {
            "gdp_size": 3.4,
            "gdp_growth": 72.8,
            "population": 19.2,
            "urbanization": 36.2,
            "gni_per_capita": 2.9,
            "fdi_inflow": 12.0
          }
        },
        {
          "rank": 18,
          "iso2": "PH",
          "score": 21.7,
          "components": {
            "gdp_size": 0.2,
            "gdp_growth": 81.8,
            "population": 7.6,
            "urbanization": 31.1,
            "gni_per_capita": 2.4,
            "fdi_inflow": 7.2
          }
        },
        {
          "rank": 19,
          "iso2": "VN",
          "score": 20.7,
          "components": {
            "gdp_size": 0.2,
            "gdp_growth": 99.2,
            "population": 6.6,
            "urbanization": 4.8,
            "gni_per_capita": 2.4,
            "fdi_inflow": 10.7